{
  "event_id": "EVT-DEMO-SESSION-001",
  "idempotency_key": "demo:session:001",
  "source_thread": "dictation",
  "student_id": "STU-001",
  "session": {
    "session_id": "SES-DEMO-001",
    "session_type": "dictation",
    "title": "Anonymous vocabulary review",
    "started_at": "2026-01-15T09:00:00+08:00"
  },
  "observations": [
    {
      "observation_type": "teacher_observation",
      "observation_text": "The learner needed extra retrieval time.",
      "evidence_level": "session_only"
    }
  ]
}

